{
  "version": "1",
  "principal": {
    "agent_id": "billing-bot",
    "owner": "alice@example.com",
    "run_id": "01J9ZK3M2Q4R5S6T7V8W9X0Y1Z",
    "session_id": "mcp-sess-7f3a"
  },
  "action": {
    "server": "stripe",
    "tool": "refund",
    "args": { "charge": "ch_123", "amount": 120.5 }
  },
  "context": {
    "time": "2026-10-11T14:03:07Z",
    "estimated_cost": { "micros": 120500000, "currency": "USD" },
    "budget_remaining": {
      "per_run": { "micros": 500000000, "currency": "USD" },
      "daily": { "micros": 4200000000, "currency": "USD" }
    },
    "grants": [
      {
        "id": "grant-01J9ZK4",
        "approval_id": "apr-01J9ZK3",
        "scope": "run",
        "agent_id": "billing-bot",
        "run_id": "01J9ZK3M2Q4R5S6T7V8W9X0Y1Z",
        "server": "stripe",
        "tool": "list_charges",
        "until": "2026-10-12T14:00:00Z"
      }
    ]
  }
}
